{"authentication_mode":"totp","daily_timer":{"active":true,"enabled":true,"persistent":false},"games_snapshot":"48c4701a2673a5c3e77dff4387de2c5c54c3eb6b1b940f3223db435641152d25","interruption":false,"maintenance_timer":{"active":true,"enabled":true,"persistent":false},"nfs_snapshot":"49ff11996bce52054317c534dd83afb56af12e94493c8659f4a86c6581e2bc7a","pending":0,"policy_sha256":"c13f570e78e9b30394992f81043168dbcf54535ad0ca18d56921734971fe46e7","production_lock_absent":true,"proton_snapshot":"694d8818b8ec6bc918134e0a116b2dfd820ae59ed0c3a1a7810253b1a3597dc6","qualification_evidence_sha256":"ff1a7bb5da839a7239343cbd0a13e395aa697ff57bfb6166ea8a29673239df31","recovery_bundle_evidence_sha256":"815a3ac510158045c90a4c651c2da9929b7863fee3180b1f15204d13a103ad90","repositories_ready":true,"snapshot_time":"2026-08-27T05:12:36Z","source_commit":"280f58692b087e5d8f937848beee1c953e4a2859","transition_evidence_sha256":"3080e6da1d1ba6d9f7d02d976fcdca5f458b29a720967b8a9619d38f03b4b243","verified_at":"2026-08-27T05:22:42Z","version":1}
